,Text#,Type,Issued,Title,Language,Authors,Subjects,LoCC,Bookshelves
719,46333,Text,2014-07-19,The Social Contract & Discourses,en,"Rousseau, Jean-Jacques, 1712-1778; Cole, G. D. H. (George Douglas Howard), 1889-1959 [Translator]",Economics; Political science -- Early works to 1800; Social contract,J,
720,64197,Text,2021-01-06,"Magna Carta, and Other Addresses",en,"Guthrie, William D. (William Dameron), 1859-1935",Constitutional law -- United States,K,
721,40613,Text,2012-08-29,"Arguments before the Committee on Patents of the House of Representatives, conjointly with the Senate Committee on Patents, on H.R. 19853, to amend and consolidate the acts respecting copyright
June 6, 7, 8, and 9, 1906.",en,United States. Congress. House. Committee on Patents; United States. Congress. Senate. Committee on Patents,Copyright -- United States,K,
722,64898,Text,2021-03-21,Judgments in Vacation,en,"Parry, Edward Abbott, Sir, 1863-1943",Law -- Great Britain -- Anecdotes,K,
723,64773,Text,2021-03-10,"The history of the London Burkers
Containing a faithful and authentic account of the horrid acts of the noted Resurrectionists, Bishop, Williams, May, etc., etc., and their trial and condemnation at the Old Bailey for the wilful murder of Carlo Ferrari, with the criminals' confessions after trial. Including also the life, character, and behaviour of the atrocious Eliza Ross, the murderer of Mrs. Walsh, etc., etc.",en,Anonymous,"Trials (Murder) -- England -- London; Bishop, John, -1831; Williams, Thomas, -1831; May, James, -1832; Ross, Eliza, 1793 or 1794-1832",K,
724,63467,Text,2020-10-16,"Trial of the Major War Criminals Before the International Military Tribunal, Nuremburg, 14 November 1945-1 October 1946, Volume 09",en,Various,"Göring, Hermann, 1893-1946 -- Trials, litigation, etc.; Nuremberg Trial of Major German War Criminals, Nuremberg, Germany, 1945-1946; War crime trials -- Germany -- Nuremberg",K,
725,19581,Sound,2006-10-20,Amendments to the United States Constitution,en,United States,Constitutional amendments -- United States,K,Politics; United States
726,64666,Text,2021-03-01,Patents and How to Get One: A Practical Handbook,en,United States. Department of Commerce,Patent practice -- United States -- Popular works,K,
727,41046,Text,2012-10-16,"International Law. A Treatise. Volume 1 (of 2)
Peace. Second Edition",en,"Oppenheim, L. (Lassa), 1858-1919",International law,K,
728,17041,Text,2005-11-10,The Man in Court,en,"Wells, Frederic DeWitt, 1874-1929",Courts -- United States; Trial practice -- United States,K,
729,44565,Text,2014-01-02,"Die Freigabe der Vernichtung lebensunwerten Lebens
Ihr Maß und ihre Form; Zweite Auflage",de,"Binding, Karl, 1841-1920; Hoche, Alfred, 1865-1943",Assisted suicide -- Law and legislation -- Germany; Euthanasia -- Law and legislation -- Germany; Suicide -- Germany,K,
730,30802,Text,2009-12-30,"Commentaries on the Laws of England, Book the First",en,"Blackstone, William, Sir, 1723-1780",Law -- England -- History; Law -- England,K,British Law
731,12235,Text,2004-05-01,"Popular Law-making
A study of the origin, history, and present tendencies of law-making by statute",en,"Stimson, Frederic Jesup, 1855-1943",Legislation -- United States,K,British Law
732,686,Text,1996-10-01,"The Treaty of the European Union, Maastricht Treaty, 7th February, 1992",en,European Union,European federation; Europe -- Economic integration; European Union,K,
733,32984,Text,2010-06-27,An Essay on the Trial by Jury,en,"Spooner, Lysander, 1808-1887",Jury -- United States; Jury -- Great Britain,K,
734,27078,Text,2008-10-28,"Senate Resolution 6; 41st Congress, 1st Session
A Bill to provide stationery for Congress and the several departments, and for other purposes",en,United States. Congress. Senate,"Bills, Legislative -- United States; Legislation -- United States",K,
735,36145,Text,2011-05-18,"No Treason, Vol. VI.: The Constitution of No Authority",en,"Spooner, Lysander, 1808-1887",Constitutional law -- United States,K,
736,58019,Text,2018-10-03,"The Infamous Life of John Church, the St. George's Fields Preacher
From His Infancy Up to His Trial and Conviction, With His Confession, Sent in a Letter to the Rev. Mr. L--, Two Days After His Attack on Adam Foreman, at Vauxhall, With Clerical Remarks by the Same Gentleman; to Which Is Added, His Love Epistles to E**** B****.   Together With Various Other Letters, Particularly One to Cook, of Vere-Street Notoriety.",en,Anonymous,"Church, J. (John), approximately 1780-approximately 1825; Church, J. (John), approximately 1780-approximately 1825 -- Trials, litigation, etc.; Trials (Sodomy) -- England",K,
737,21173,Sound,2007-04-26,The Riot Act,en,Great Britain. Parliament,Law -- Great Britain,K,British Law
738,56213,Text,2017-12-20,"Nazi Conspiracy and Aggression, Volume 02 (of 11)",en,United States. Office of Chief of Counsel for the Prosecution of Axis Criminality,"Nuremberg Trial of Major German War Criminals, Nuremberg, Germany, 1945-1946; War crime trials -- Germany -- Nuremberg; World War, 1939-1945 -- Germany; World War, 1939-1945 -- Atrocities; Germany -- Politics and government -- 1933-1945",K,
739,46246,Text,2014-07-10,"Historia General del Derecho Español, Tomo I",es,"Hinojosa, Eduardo de",Law -- Spain -- History,K,
740,65083,Text,2021-04-14,Race Distinctions in American Law,en,"Stephenson, Gilbert Thomas, 1884-1972",United States -- Race relations; Law -- United States -- History; African Americans -- Politics and government,K,
741,31891,Text,2010-04-05,"Essays on the Constitution of the United States
Published during its Discussion by the People, 1787-1788",en,"Ford, Paul Leicester, 1865-1902 [Editor]",Constitutional history -- United States -- Sources; United States. Constitution,K,
742,66056,Text,2021-08-13,"The Great Harry Thaw Case; Or, A Woman's Sacrifice",en,"Atwell, Benjamin H.","Thaw, Harry Kendall, 1871-1947 -- Trials, litigation, etc.; Nesbit, Evelyn, 1884-1967; White, Stanford, 1853-1906; Trials (Murder) -- New York (State) -- New York",K,
743,28962,Text,2009-05-25,Tribunaes de Arbitros-Avindores,pt,"Bastos, Teixeira, 1857-1902","Arbitration, Industrial -- Portugal",K,
744,11591,Text,2004-03-01,Hugo de Groot en zijn rechtsphilosophie,nl,"Bertens, H.","Law -- Philosophy; Grotius, Hugo, 1583-1645",K,
745,51293,Text,2016-02-24,The Law and Medical Men,en,"Rogers, R. Vashon (Robert Vashon), 1843-1911",Medical laws and legislation,K,
746,56145,Text,2017-12-07,"Tribal Custom in Anglo-Saxon Law
Being an Essay Supplemental to (1) 'The English Village Community', (2) 'The Tribal System in Wales'",en,"Seebohm, Frederic, 1833-1912","Anglo-Saxons; Law, Anglo-Saxon; Tribes -- Great Britain; Law, Medieval",K,
747,6603,Text,2004-10-01,Our Legal Heritage : 600-1776 King Aethelbert - King George III,en,"Reilly, S. A.",Law -- England -- History,K,British Law
748,43945,Text,2013-10-13,"A Treatise Upon the Law of Copyright in the United Kingdom and the Dominions of the Crown,
and in the United States of America Containing a Full Appendix of All Acts of Parliament International Conventions, Orders in Council, Treasury Minute and Acts of Congress Now in Force.",en,"MacGillivray, Evan James, 1873-1955",Copyright -- United States; Copyright -- Great Britain,K,
749,58053,Text,2018-10-07,"A Correct Account of the Horrible Occurrence Which Took Place at a Public-House in St. James's Market
In Which It Was Discovered That the Right Rev. Father in God the Bishop of Clogher, Lately Transferred From the Bishopric of Ferns, Was a Principal Actor With a Common Soldier! To the Disgrace Not Only of the Cloth, to Which He Was Attached, and as a Commissioner of the Board of Education, and a Dictator of Public Morals, but as a Member of That Nation Which Gave Him Birth!",en,Anonymous,"Trials (Sodomy) -- England; Jocelyn, Percy, 1764-1843 -- Trials, litigation, etc.",K,
750,17538,Text,2006-02-07,Les lois sociologiques,fr,"Greef, Guillaume de, 1842-1924",Social psychology; Sociological jurisprudence,K,FR Sciences et Techniques
751,43286,Text,2013-07-23,The Criminal Prosecution and Capital Punishment of Animals,en,"Evans, E. P. (Edward Payson), 1831-1917","Animals, Prosecution and punishment of -- History; Animals -- Law and legislation -- History; Trials -- Europe",K,
752,60134,Text,2019-08-18,Lumber Legal Opinions,en,National Wholesale Lumber Dealers Association. Bureau of Information. Legal Department [Other],Lumber trade -- United States -- Cases; Legal opinions -- United States -- Cases,K,
753,24289,Text,2008-01-15,"Ley, porque V. Magestade ha por bem restituir aos indios do Grão Pará, e Maranhão a liberdade das suas pessoas, e bens etc.",pt,Anonymous,"Indians, Treatment of -- Brazil -- Early works to 1800; Indians of South America -- Legal status, laws, etc. -- Brazil -- Early works to 1800; Portugal. Laws, etc.",K,
754,49405,Text,2015-07-09,Trial of Deacon Brodie,en,"Roughead, William, 1870-1952 [Editor]; Brodie, William, 1741-1788 [Other]; Smith, George, -1788 [Other]","Brodie, William, 1741-1788 -- Trials, litigation, etc.; Trials (Robbery) -- Scotland",K,
755,27515,Text,2008-12-13,"State Trials, Political and Social. Volume 1 (of 2)",en,"Stephen, Harry Lushington, 1860-1945 [Editor]",Trials -- Great Britain,K,
756,40679,Text,2012-09-05,"History of the Origin, Formation, and Adoption of the Constitution of the United States, Vol. 2
With Notices of Its Principle Framers",en,"Curtis, George Ticknor, 1812-1894",Constitutional history -- United States,K,
757,608,Text,2006-01-21,"Areopagitica
A Speech for the Liberty of Unlicensed Printing to the Parliament of England",en,"Milton, John, 1608-1674",Freedom of the press -- Early works to 1800,K,Harvard Classics; Banned Books from Anne Haight's list
758,1694,Text,1999-04-01,"Our Legal Heritage: The First Thousand Years: 600 - 1600
King Aethelbert - Queen Elizabeth",en,"Reilly, S. A.",Law -- England -- History,K,British Law
759,63241,Text,2020-09-19,"Medical Jurisprudence, Volume 1 (of 3)",en,"Fonblanque, J. S. M. (John Samuel Martin), 1787-1865; Paris, John Ayrton, 1785-1856",Medical laws and legislation -- Great Britain,K,
760,46564,Text,2014-08-11,The Rights of War and Peace,en,"Grotius, Hugo, 1583-1645; Hill, David Jayne, 1850-1932 [Author of introduction, etc.]; Campbell, A. C. (Archibald Colin) [Translator]",War (International law); International law; Natural law,K,
761,50636,Text,2015-12-07,"Reports of Trials for Murder by Poisoning;
by Prussic Acid, Strychnia, Antimony, Arsenic, and Aconita. Including the trials of Tawell, W. Palmer, Dove, Madeline Smith, Dr. Pritchard, Smethurst, and Dr. Lamson, with chemical introduction and notes on the poisons used",en,"Browne, G. Lathom (George Lathom), 1815-1892; Stewart, C. G. (Charles G.), active 19th century",Poisons; Trials (Murder) -- Great Britain; Trials (Poisoning) -- Great Britain; Medical jurisprudence -- Great Britain,K,
762,55839,Text,2017-10-28,The Law's Lumber Room (Second Series),en,"Watt, Francis, 1849-1927",Law -- Great Britain,K,
763,14905,Text,2005-02-04,Traité du Pouvoir du Magistrat Politique sur les choses sacrées,fr,"Grotius, Hugo, 1583-1645",Church and state -- Early works to 1800; Ecclesiastical law -- Early works to 1800,K,FR Politique
764,60238,Text,2019-09-05,"The New Jersey Law Journal, January, 1922
Vol. XLV. No. 1. Jan., 1922",en,"Various; Honeyman, A. Van Doren (Abraham Van Doren), 1849-1936 [Editor]","Law -- New Jersey -- Periodicals; Law reports, digests, etc. -- New Jersey",K,
765,21918,Text,2007-06-24,"Hindu Law and Judicature
from the Dharma-Sástra of Yájnavalkya",en,"Yájnavalkya; Montriou, W. A. (William Austin), 1810- [Translator]; Röer, Edward, 1805-1866 [Translator]",Hindu law,K,Hinduism
766,54905,Text,2017-06-14,"Trials of War Criminals before the Nuernberg Military Tribunals under Control Council Law No. 10, Volume II",en,Various,"Nuremberg Trial of Major German War Criminals, Nuremberg, Germany, 1945-1946; War crime trials -- Germany -- Nuremberg",K,World War II
767,27526,Text,2008-12-13,The Public Domain: Enclosing the Commons of the Mind,en,"Boyle, James, 1959-",Intellectual property; Public domain (Copyright law),K,
768,252,Text,1995-04-01,"Copyright Law of the United States of America
Contained in Title 17 of the United States Code",en,Library of Congress. Copyright Office; United States,Copyright -- United States,K,
769,64926,Text,2021-03-26,"Medical Jurisprudence, Volume 3 (of 3)",en,"Fonblanque, J. S. M. (John Samuel Martin), 1787-1865; Paris, John Ayrton, 1785-1856",Medical laws and legislation -- Great Britain,K,
770,4292,Text,2003-07-01,Copyright Basics,en,Library of Congress. Copyright Office,Copyright -- United States; Copyright licenses -- United States,K,
771,38916,Text,2012-02-18,"The Trial of Oscar Wilde, from the Shorthand Reports",en,"Grolleau, Charles, 1867-1940","Wilde, Oscar, 1854-1900 -- Trials, litigation, etc.; Taylor, Alfred, 1862 or 1863- -- Trials, litigation, etc.; Queensberry, John Sholto Douglas, Marquis of, 1844-1900 -- Trials, litigation, etc.; Trials (Slander) -- Great Britain",K,
772,39055,Text,2012-03-05,"The Trial of Henry Hetherington, on an Indictment for Blasphemy",en,"Hetherington, H. (Henry), 1792-1849","Hetherington, H. (Henry), 1792-1849 -- Trials, litigation, etc.; Trials (Blasphemy) -- England -- London",K,
773,51135,Text,2016-02-06,"The Most Extraordinary Trial of William Palmer, for the Rugeley Poisonings, which lasted Twelve Days",en,Anonymous,"Trials (Murder) -- England -- London; Cook, John Parsons, -1855; Palmer, William, 1824-1856 -- Trials, litigation, etc.; Trials (Poisoning) -- England -- London; Poisoning -- England -- Rugeley",K,
774,40781,Text,2012-09-17,"The Art of Cross-Examination
With the Cross-Examinations of Important Witnesses in Some Celebrated Cases",en,"Wellman, Francis L. (Francis Lewis), 1854-1942",Cross-examination -- United States,K,
775,40374,Text,2012-07-30,"De l'origine et de l'institution du notariat
Précis historique lu à  l'Academie des Sciences, belles-lettres et arts de Clermont-Ferrand",fr,"Fabre, Euryale, 1809-1891",Notaries -- History,K,FR Histoire; FR Services publics
776,54460,Text,2017-03-31,"Trial of the Major War Criminals Before the International Military Tribunal, Nuremburg, 14 November 1945-1 October 1946, Volume 04",en,Various,"Göring, Hermann, 1893-1946 -- Trials, litigation, etc.; Nuremberg Trial of Major German War Criminals, Nuremberg, Germany, 1945-1946; War crime trials -- Germany -- Nuremberg",K,World War II
777,7773,Text,2005-03-01,Diamond Dust,en,"Shearin, K. Kay",Whistle blowing -- Delaware,K,
778,37368,Text,2011-09-09,The Right to Privacy,en,"Brandeis, Louis Dembitz, 1856-1941; Warren, Samuel D. (Samuel Dennis), 1852-1910","Privacy, Right of",K,
779,36799,Text,2011-07-20,"The History of the Last Trial by Jury for Atheism in England
A Fragment of Autobiography Submitted for the Perusal of Her Majesty's Attorney-General and the British Clergy",en,"Holyoake, George Jacob, 1817-1906","Holyoake, George Jacob, 1817-1906 -- Trials, litigation, etc.; Trials (Blasphemy) -- England; Atheism -- England",K,
780,38238,Text,2011-12-06,The Old Yellow Book: Source of Robert Browning's The Ring and the Book,en,"Hodell, Charles W. (Charles Wesley), 1872-1925 [Editor]","Browning, Robert, 1812-1889. Ring and the book -- Sources; Franceschini, Pompilia, 1680-1698; Trials (Murder) -- Italy -- Rome -- History -- 17th century -- Sources; Law -- Italy",K,
781,51334,Text,2016-02-29,The Story of Elizabeth Canning Considered,en,"Hill, John, 1714?-1775","Canning, Elizabeth, 1734-1773 -- Trials, litigation, etc.; Fielding, Henry, 1707-1754. Clear state of the case of Elizabeth Canning; Trials (Perjury) -- England",K,
782,14904,Text,2005-02-04,Constituição politica da Monarchia portugueza,pt,Portugal,Constitutions -- Portugal,K,PT Política e Sociedade
783,31425,Text,2010-02-27,"Report of the Decision of the Supreme Court of the United States, and the Opinions of the Judges Thereof, in the Case of Dred Scott versus John F. A. Sandford
December Term, 1856.",en,"Howard, Benjamin C. (Benjamin Chew), 1791-1872; United States. Supreme Court; Sanford, John F. A., 1807?-1857 [Other]; Scott, Dred, 1809-1858 [Other]","Slavery -- United States; Scott, Dred, 1809-1858",K,Noteworthy Trials(Bookshelf)
784,58534,Text,2018-12-26,The Prisoner at the Bar: Sidelights on the Administration of Criminal Justice,en,"Train, Arthur Cheney, 1875-1945","Crime -- United States; Criminal justice, Administration of -- United States",K,
785,36045,Text,2011-05-06,The Law and the Poor,en,"Parry, Edward Abbott, Sir, 1863-1943",Law -- England; Poor laws -- England; Working class -- England; Poor -- England,K,
786,65233,Text,2021-05-02,What the Judge Saw: Being Twenty-Five Years in Manchester by One Who Has Done It,en,"Parry, Edward Abbott, Sir, 1863-1943",Law -- Humor; Law -- Anecdotes,K,
787,54235,Text,2017-02-26,The Office of Bailiff of a Liberty,en,"Ritson, Joseph, 1752-1803; Frank, Joseph, 1774?- [Editor]",Bailiffs,K,
788,30632,Text,2009-12-08,"Homeland Security Act of 2002
Updated Through October 14, 2008",en,"United States. Congress. House. Committee on Homeland Security; Twinchek, Michael [Editor]",United States. Homeland Security Act of 2002; United States. Dept. of Homeland Security; National security -- Law and legislation -- United States; Administrative agencies -- United States -- Reorganization; Terrorism -- United States -- Prevention; Emergency management -- United States,K,
789,66028,Text,2021-08-09,"Trial of the Major War Criminals Before the International Military Tribunal, Nuremburg, 14 November 1945-1 October 1946, Volume 12",en,Various,"Göring, Hermann, 1893-1946 -- Trials, litigation, etc.; Nuremberg Trial of Major German War Criminals, Nuremberg, Germany, 1945-1946; War crime trials -- Germany -- Nuremberg",K,
790,38088,Text,2011-11-22,"State Trials, Political and Social. Volume 2 (of 2)",en,"Stephen, Harry Lushington, 1860-1945 [Editor]",Trials -- Great Britain,K,
791,22359,Text,2007-08-20,"An Essay on Professional Ethics
Second Edition",en,"Sharswood, George, 1810-1883",Legal ethics -- United States,K,
792,40400,Text,2012-08-03,"History of the Origin, Formation, and Adoption of the Constitution of the United States, Vol. 1
With Notices of Its Principle Framers",en,"Curtis, George Ticknor, 1812-1894",Constitutional history -- United States,K,
793,4291,Text,2003-07-01,"Copyright Law of the United States of America and Related Laws Contained in Title 17 of the United States Code, Circular 92",en,Library of Congress. Copyright Office; United States,Copyright -- United States,K,
794,2449,Text,2000-12-01,The Common Law,en,"Holmes, Oliver Wendell, 1841-1935",Common law,K,United States Law
795,32298,Text,2010-05-08,"Anciennes loix des François conservées dans les coutumes angloises recueillies par Littleton, Vol. II",fr,"Hoüard, David, 1725-1802; Littleton, Thomas, Sir, -1481",Customary law -- France; Customary law -- Great Britain,K,British Law; FR Droit et Justice
796,1341,Text,1998-06-01,The Altruist in Politics,en,"Cardozo, Benjamin N. (Benjamin Nathan), 1870-1938",Law; Judicial process,K,
797,20570,Text,2007-02-11,A penalidade na India segundo o Código de Manu,pt,"Figueiredo, Cândido de, 1846-1925",Manu; Criminal law -- India,K,
798,41888,Text,2013-01-20,"De Mortuis Nil Nisi Bona
Being a Series of Problems in Executorship Law and Accounts",en,"Pegler, Ernest Charles; Spicer, Ernest Evan; Ranking, Devey Fearon de l'Hoste, 1848?-1931 [Author of introduction, etc.]; Reed, Edward Tennyson, 1860-1933 [Illustrator]",Executors and administrators -- Great Britain; Decedents' estates -- Great Britain,K,
799,51646,Text,2016-04-03,"The War Book of the German General Staff
Being ""The Usages of War on Land"" Issued by the Great General Staff of the German Army",en,"Prussia (Germany). Armee. Grosser Generalstab. Kriegsgeschichtliche Abteilung II; Morgan, J. H. (John Hartman), 1876-1955 [Translator]","War (International law); World War, 1914-1918 -- Law and legislation -- Germany",K,
800,61000,Text,2020-01-01,The Book of Trinity College Dublin 1591-1891,en,"Trinity College (Dublin, Ireland)","Trinity College (Dublin, Ireland)",L,
801,5427,Text,2004-04-01,Emile,en,"Rousseau, Jean-Jacques, 1712-1778",Education -- Early works to 1800,L,Banned Books from Anne Haight's list
802,29630,Text,2009-08-07,The Curse of Education,en,"Gorst, Harold Edward, 1868-1950",Education,L,
803,33817,Text,2010-09-28,"Ensino intuitivo
livro destinado às mães e paes de familia e às professoras e professores de instrucção primária",pt,"Telles, João José de Sousa, 1826-1903",Education,L,
804,37893,Text,2011-10-31,Oxford and Her Colleges: A View from the Radcliffe Library,en,"Smith, Goldwin, 1823-1910",University of Oxford,L,
805,63669,Text,2020-11-07,"The Story Tellers' Magazine, Vol. I, No. 1, June 1913",en,"Various; Wyche, Richard Thomas [Editor]",Storytelling -- Periodicals,L,
806,45185,Text,2014-03-21,"Burritt College Centennial Celebration, August 13-15, 1948
Address by Charles Lee Lewis",en,"Lewis, Charles Lee, 1886-1951",Burritt College -- History,L,
807,34272,Text,2010-11-10,Beretning om Folke-Høiskolen i Rødding,da,"Flor, Christian, 1792-1875",Education -- Denmark; Folk high schools -- Denmark,L,
808,12138,Text,2004-04-01,"The History of University Education in Maryland
The Johns Hopkins University (1876-1891). With supplementary notes on university extension and the university of the future",en,"Steiner, Bernard C. (Bernard Christian), 1867-1926; Gilman, Daniel Coit, 1831-1908 [Contributor]; Moulton, Richard G. (Richard Green), 1849-1924 [Contributor]",Johns Hopkins University -- History; Universities and colleges -- Maryland -- History,L,
809,11089,Text,2004-02-01,"The Education of the Negro Prior to 1861
A History of the Education of the Colored People of the United States from the Beginning of Slavery to the Civil War",en,"Woodson, Carter Godwin, 1875-1950",African Americans -- Education,L,
810,55558,Text,2017-09-16,"The Boarding School; Lessons of a Preceptress to Her Pupils
Consisting of Information, Instruction and Advice, Calculated to Improve the Manners and Form the Character of Young Ladies. To Which Is Added, a Collection of Letters, Written by the Pupils to Their Instructress, Their Friends, and Each Other.",en,"Foster, Hannah Webster, 1759-1840",Women -- Education -- Early works to 1800,L,
811,11667,Text,2004-03-01,"Gentle Measures in the Management and Training of the Young
Or, the Principles on Which a Firm Parental Authority May Be Established and Maintained, Without Violence or Anger, and the Right Development of the Moral and Mental Capacities Be Promoted by Methods in Harmony with the Structure and the Characteristics of the Juvenile Mind",en,"Abbott, Jacob, 1803-1879","Child rearing; Education, Primary; Discipline of children",L,
812,57028,Text,2018-04-23,A Dominie's Log,en,"Neill, Alexander Sutherland, 1883-1973","Education -- Philosophy; Neill, Alexander Sutherland, 1883-1973; Education -- Scotland; Teachers -- Scotland -- Biography",L,
813,21419,Text,2007-05-11,The Children: Some Educational Problems,en,"Darroch, Alexander, 1863-1910",Education; Education and state,L,
814,33923,Text,2010-10-14,Special Method in Primary Reading and Oral Work with Stories,en,"McMurry, Charles A. (Charles Alexander), 1857-1929",Reading (Elementary),L,
815,34938,Text,2011-01-13,Education: How Old The New,en,"Walsh, James J. (James Joseph), 1865-1942",Education -- History,L,
816,62064,Text,2020-05-09,"Rules of the Western Grammar School, Brompton",en,"Western Grammar School (Brompton, England)","Western Grammar School (Brompton, England); Schools -- England -- Brompton -- History",L,
817,25306,Text,2008-05-02,A Dominie in Doubt,en,"Neill, Alexander Sutherland, 1883-1973","Education -- Philosophy; Neill, Alexander Sutherland, 1883-1973; Education -- Scotland; Teachers -- Scotland -- Biography",L,
818,46018,Text,2014-06-18,Loyola and the Educational System of the Jesuits,en,"Hughes, Thomas, 1849-1939; Butler, Nicholas Murray, 1862-1947 [Editor]","Education -- History; Ignatius, of Loyola, Saint, 1491-1556; Jesuits",L,
819,8940,Text,2005-09-01,An Essay on the Evils of Popular Ignorance,en,"Foster, John, 1770-1843",Education; Missions -- India; Great Britain -- Social conditions -- 19th century; Religious education; Literacy,L,
820,46080,Text,2014-06-23,Earliest Years at Vassar: Personal Recollections,en,"Wood, Frances Ann, 1840-",Vassar College,L,
821,30433,Text,2009-11-09,"Émile; Or, Concerning Education; Extracts",en,"Rousseau, Jean-Jacques, 1712-1778; Steeg, Jules, 1836-1898 [Editor]; Worthington, Eleanor [Translator]",Education,L,Banned Books from Anne Haight's list
822,31618,Text,2010-03-13,"Silver Links
A collection of salutatory, valedictory and other addresses delivered at the first five commencements of the female stenographic and typewriting class of the General Society of Mechanics and Tradesmen of the City of New York",en,"Mason, W. L. (William Lesley), 1861- [Compiler]",Baccalaureate addresses -- General Society of Mechanics and Tradesmen of the City of New York,L,
823,64584,Text,2021-02-17,"The Trinity Archive, Vol. I, No. 8, June 1888",en,"Trinity College (Randolph County, N.C.)","Trinity College (Randolph County, N.C.) -- Periodicals; College student newspapers and periodicals -- North Carolina -- Trinity",L,
824,51580,Text,2016-03-28,"On the Future of our Educational Institutions; Homer and Classical Philology
Complete Works, Volume Three",en,"Nietzsche, Friedrich Wilhelm, 1844-1900; Levy, Oscar, 1867-1946 [Editor]; Kennedy, J. M. (John McFarland) [Translator]","Homer; Classical philology; Education -- Philosophy; Nietzsche, Friedrich Wilhelm, 1844-1900 -- Views on education; Educational change -- Germany",L,
825,19768,Text,2006-11-12,"Professor Royce's Libel
A Public Appeal for Redress to the Corporation and Overseers of Harvard University",en,"Abbot, Francis Ellingwood, 1836-1903",Literary ethics; Plagiarism,L,
