,Text#,Type,Issued,Title,Language,Authors,Subjects,LoCC,Bookshelves
371,19042,Text,2006-08-14,Animal Figures in the Maya Codices,en,"Allen, Glover M. (Glover Morrill), 1879-1942; Tozzer, Alfred M. (Alfred Marston), 1877-1954",Mayas -- Antiquities; Mayan languages -- Writing,E,Anthropology
372,37633,Text,2011-10-05,Societies of the Kiowas,en,"Lowie, Robert Harry, 1883-1957",Indians of North America -- Social life and customs; Kiowa Indians,E,
373,36619,Text,2011-07-04,"The Colonization of North America, 1492-1783",en,"Bolton, Herbert Eugene, 1870-1953; Marshall, Thomas Maitland, 1876-1936","Great Britain -- Colonies -- America; Spain -- Colonies -- America; France -- Colonies -- America; North America -- History -- Colonial period, ca. 1600-1775",E,
374,51226,Text,2016-02-16,Connecticut Wide-Awake Songster,en,"Hutchinson, John W. (John Wallace), 1821-1908 [Editor]; Jepson, B. (Benjamin), 1832-1914 [Editor]","Lincoln, Abraham, 1809-1865 -- Songs and music -- Texts; Campaign songs, 1860 -- Republican -- Texts; Political ballads and songs -- United States -- Texts",E,
375,48822,Text,2015-04-29,"Three Years in the Service
A Record of the Doings of the 11th Reg. Missouri Vols.",en,"McCall, D.","United States -- History -- Civil War, 1861-1865 -- Personal narratives; United States -- History -- Civil War, 1861-1865 -- Regimental histories; United States. Army. Missouri Infantry Regiment, 11th (1861-1866); Missouri -- History -- Civil War, 1861-1865 -- Regimental histories",E,
376,35952,Text,2011-04-24,The Sun Dance of the Blackfoot Indians,en,"Wissler, Clark, 1870-1947",Siksika Indians; Sun dance,E,
377,33812,Text,2010-09-26,The Aboriginal Population of the North Coast of California,en,"Cook, Sherburne Friend, 1896-1974",Indians of North America -- California; Indians of North America -- Statistics,E,
378,36012,Text,2011-05-01,"Prairie Smoke, a Collection of Lore of the Prairies",en,"Gilmore, Melvin R. (Melvin Randolph), 1868-1940",Indians of North America -- Folklore; Dakota Indians -- Folklore,E,
379,35400,Text,2011-02-25,"Presidential Candidates:
Containing Sketches, Biographical, Personal and Political, of Prominent Candidates for the Presidency in 1860",en,"Bartlett, D. W. (David W.), 1828-1912",Statesmen -- United States; United States -- Biography,E,
380,12541,Text,2004-06-01,The American Indian as Participant in the Civil War,en,"Abel, Annie Heloise, 1873-1947","Indians of North America -- History -- Civil War, 1861-1865; Indians of North America -- Indian Territory -- History; United States -- History -- Civil War, 1861-1865 -- Participation, Indian",E,Native America; US Civil War
381,55707,Text,2017-10-08,John Brown the Hero: Personal Reminiscences,en,"Winkley, J. W. (Jonathan Wingate), 1833-1912; Sanborn, F. B. (Franklin Benjamin), 1831-1917 [Author of introduction, etc.]","Brown, John, 1800-1859",E,
382,31279,Text,2010-02-15,"A Review of Hoffman's Race Traits and Tendencies of the American Negro
The American Negro Academy. Occasional Papers No. 1",en,"Miller, Kelly, 1863-1939","African Americans; Hoffman, Frederick L. (Frederick Ludwig), 1865-1946. Race traits and tendencies of the American Negro",E,
383,49789,Text,2015-08-26,"Charles Sumner: his complete works, volume 12 (of 20)",en,"Sumner, Charles, 1811-1874","Slavery -- United States; Speeches, addresses, etc., American",E,
384,28992,Text,2009-05-29,James Madison,en,"Gay, Sydney Howard, 1814-1888","Presidents -- United States -- Biography; United States -- Politics and government -- 1783-1809; Madison, James, 1751-1836; United States -- Politics and government -- 1809-1817",E,
385,45654,Text,2014-05-15,The Life of Albert Gallatin,en,"Adams, Henry, 1838-1918","Gallatin, Albert, 1761-1849",E,
386,58975,Text,2019-02-27,"Index of Project Gutenberg Works on Black History
A 2019 Project Gutenberg Contribution for Black History Month",en,"Various; Widger, David, 1932- [Editor]",African Americans -- History; Indexes,E,
387,46175,Text,2014-07-02,"The History of the Confederate War, Its Causes and Its Conduct, Volume 2 (of 2)
A Narrative and Critical History",en,"Eggleston, George Cary, 1839-1911","United States -- History -- Civil War, 1861-1865",E,
388,38434,Text,2011-12-28,Lincoln's Use of the Bible,en,"Jackson, S. Trevena, 1867-1945","Lincoln, Abraham, 1809-1865 -- Religion; Lincoln, Abraham, 1809-1865 -- Literary art",E,
389,63175,Text,2020-09-10,"The Sia
(1894 N 11 / 1889-1890 (pages 3-158))",en,"Stevenson, Matilda Coxe, 1850-1915",Zia Indians,E,
390,408,Text,1996-01-01,The Souls of Black Folk,en,"Du Bois, W. E. B. (William Edward Burghardt), 1868-1963",African Americans,E,African American Writers
391,28000,Text,2009-01-20,Inaugural Presidential Address,en,"Obama, Barack, 1961-","Presidents -- United States -- Inaugural addresses; Obama, Barack, 1961- -- Inauguration, 2009",E,
392,29850,Text,2009-08-29,Woodrow Wilson's Administration and Achievements,en,"Bryan, James William, 1882-1952; Lord, Frank B.","United States -- Politics and government -- 1913-1921; Wilson, Woodrow, 1856-1924",E,
393,35352,Text,2011-02-21,"Papers of the American Negro Academy. (The American Negro Academy. Occasional Papers, No. 18-19.)",en,"Cromwell, John Wesley, 1846-1927; Grimké, Archibald Henry, 1849-1930; Hershaw, Lafayette M., 1863-1945; Pickens, William, 1881-1954; Schomburg, Arthur Alfonso, 1874-1938; Steward, T. G. (Theophilus Gould), 1843-1924",African Americans -- Congresses,E,
394,58541,Text,2018-12-26,Pioneer Colored Christians,en,"Miller, Harriet Parks",African Americans -- Religion; African Americans -- Southern States; Carr family,E,
395,5854,Text,2004-06-01,"Personal Memoirs of P. H. Sheridan, Volume 1, Part 1",en,"Sheridan, Philip Henry, 1831-1888","Generals -- United States -- Biography; United States -- History -- Civil War, 1861-1865 -- Campaigns; United States -- History -- Civil War, 1861-1865 -- Personal narratives; United States. Army -- Biography; Sheridan, Philip Henry, 1831-1888; Indians of North America -- Wars -- 1866-1895",E,US Civil War
396,44116,Text,2013-11-05,"A History of the Ninth Regiment, Illinois Volunteer Infantry",en,"Morrison, Marion, 1821-","United States -- History -- Civil War, 1861-1865 -- Regimental histories; Illinois -- History -- Civil War, 1861-1865 -- Regimental histories; United States. Army. Illinois Infantry Regiment, 9th (1861-1865); United States. Army. Illinois Infantry Regiment, 9th (1861-1865) -- Registers",E,
397,63279,Text,2020-09-23,"The American Navy and Liberia
An Address before the American Colonization Society, January 18, 1876",en,"Shufeldt, Robert Wilson, 1822-1895","Speeches, addresses, etc.; United States. Navy; African Americans -- Colonization -- Liberia",E,
398,41605,Text,2012-12-11,Abigail Adams and Her Times,en,"Richards, Laura Elizabeth Howe, 1850-1943","Adams, Abigail, 1744-1818",E,
399,48409,Text,2015-03-05,Myths and Legends of British North America,en,"Judson, Katharine Berry, 1866-1929 [Editor]",Indians of North America -- Folklore; Indians of North America -- Canada -- Folklore,E,
400,33739,Text,2010-09-16,"Cuba: Its Past, Present, and Future",en,"Hall, A. D. (Arthur D.)",Cuba -- History; Cuba -- Description and travel,F,
401,35669,Text,2011-03-24,The Falls of Niagara and Other Famous Cataracts,en,"Holley, George W. (George Washington), 1810-1897",Niagara Falls (N.Y. and Ont.) -- Description and Travel; Niagara River (N.Y. and Ont.) -- History; Waterfalls,F,
402,40783,Text,2012-09-17,The Minute Man on the Frontier,en,"Puddefoot, William George, 1842-1925",Frontier and pioneer life -- West (U.S.); Missions -- West (U.S.),F,
403,63678,Text,2020-11-08,"Travels Through North and South Carolina, Georgia, East and West Florida, the Cherokee Country, the Extensive Territories of the Muscogulges, or Creek Confederacy, and the Country of the Chactaws.
Containing an Account of the Soil and Natural Productions of Those Regions, Together With Observations on the Manners of the Indians.",en,"Bartram, William, 1739-1823","Southern States -- Description and travel; Indians of North America -- Southern States; Natural history -- Southern States; Bartram, William, 1739-1823 -- Travel -- Southern States",F,
404,53719,Text,2016-12-12,The Nootka Sound Controversy: A dissertation,en,"Manning, William R. (William Ray), 1871-1942",Thesis (Ph. D.); Nootka Sound (B.C.); Vancouver Island (B.C.) -- History; Spain -- Foreign relations -- Great Britain; Great Britain -- Foreign relations -- Spain,F,
405,55381,Text,2017-08-18,"After the War: A Southern Tour. May 1, 1865 to May 1, 1866",en,"Reid, Whitelaw, 1837-1912","Reconstruction (U.S. history, 1865-1877); Plantation life; Southern States -- Description and travel",F,
406,61645,Text,2020-03-21,New York: Confidential!,en,"Lait, Jack, 1882-1954; Mortimer, Lee, 1904-1963","New York (N.Y.) -- Description and travel; New York (N.Y.) -- Social life and customs; Harlem (New York, N.Y.)",F,
407,55176,Text,2017-07-23,Cartoons and Caricatures of Seattle Citizens,en,"Bobbett, Albert, 1824?-1889? [Illustrator]; Brotze, E. F. (Edwin Frederick), 1868-1939 [Illustrator]; Calvert, Frank, 1876-1920 [Illustrator]; Dickson, Charles H. [Illustrator]; Gill, John R. [Illustrator]; Hager, George [Illustrator]; Jenner, Ernest [Illustrator]; Thurlby, Tom [Illustrator]",Seattle (Wash.) -- Biography -- Portraits,F,
408,27716,Text,2009-01-06,A Portrait of Old George Town,en,"Peter, Grace Dunlop","Georgetown (Washington, D.C.) -- History; Georgetown (Washington, D.C.) -- Description and travel",F,
409,50629,Text,2015-12-06,"An Account of the Abipones, an Equestrian People of Paraguay, (1 of 3)",en,"Dobrizhoffer, Martin, 1717-1791",Jesuits -- Missions; Abipon Indians; Paraguay -- Description and travel -- Early works to 1800,F,
410,45998,Text,2014-06-16,"Peru in the Guano Age
Being a Short Account of a Recent Visit to the Guano Deposits, with Some Reflections on the Money They Have Produced and the Uses to Which It Has Been Applied",en,"Duffield, A. J. (Alexander James), 1821-1890",Peru -- Description and travel; Guano,F,
411,17385,Text,2005-12-24,100 New Yorkers of the 1970s,en,"Millard, Max",New York (N.Y.) -- Biography,F,
412,45143,Text,2014-03-15,"The Way to the West, and the Lives of Three Early Americans: Boone—Crockett—Carson",en,"Hough, Emerson, 1857-1923; Remington, Frederic, 1861-1909 [Illustrator]","Boone, Daniel, 1734-1820; West (U.S.) -- History; Crockett, Davy, 1786-1836; Carson Kit, 1809-1868; Mississippi River Valley -- History",F,
413,59692,Text,2019-06-07,Petrified Forest National Monument (1953),en,United States. National Park Service,Petrified Forest National Park (Ariz.),F,
414,57118,Text,2018-05-08,The Padre Island Story,en,"Daly, Loraine; Reumert, Pat",Padre Island (Tex.); Rio Grande Valley (Colo.-Mexico and Tex.) -- Description and travel,F,
415,20290,Text,2007-01-05,"Perley's Reminiscences, v. 1-2
of Sixty Years in the National Metropolis",en,"Poore, Benjamin Perley, 1820-1887","United States -- Politics and government; Journalists -- United States -- Biography; Washington (D.C.) -- Social life and customs; Poore, Benjamin Perley, 1820-1887; Washington (D.C.) -- History",F,
416,18636,Text,2006-06-20,The Story of Newfoundland,en,"Birkenhead, Frederick Edwin Smith, Earl of, 1872-1930",Newfoundland and Labrador -- History; America -- Discovery and exploration -- British,F,
417,12569,Text,2004-06-01,"Through the Mackenzie Basin
A Narrative of the Athabasca and Peace River Treaty Expedition of 1899",en,"Mair, Charles, 1838-1927","Alberta -- Description and travel; Indians of North America -- Canada -- Treaties; Athabasca and Peace River treaty expedition, 1899; Mammals -- Northwest, Canadian; Birds -- Northwest, Canadian",F,
418,50302,Text,2015-10-25,The Rise and Fall of Nauvoo,en,"Roberts, B. H. (Brigham Henry), 1857-1933",Mormons -- Illinois -- Nauvoo; Nauvoo (Ill.) -- History,F,Latter Day Saints
419,4786,Text,2003-12-01,Zone Policeman 88; a close range study of the Panama canal and its workers,en,"Franck, Harry Alverson, 1881-1962",Police -- Panama -- Canal Zone; Panama Canal (Panama),F,"Bestsellers, American, 1895-1923"
420,20910,Text,2007-03-26,"South American Fights and Fighters, and Other Tales of Adventure",en,"Brady, Cyrus Townsend, 1861-1920","Peru -- History -- Conquest, 1522-1548; Dueling; Jones, John Paul, 1747-1792; Essex (Whaleship); Tonquin (Ship); Washita Campaign, 1868-1869; America -- Discovery and exploration -- Spanish; Panama -- History; Mexico -- History -- Conquest, 1519-1540",F,Children's Fiction; South America
421,17970,Text,2006-03-12,"The Olden Time Series, Vol. 1: Curiosities of the Old Lottery
Gleanings Chiefly from Old Newspapers of Boston and Salem, Massachusetts",en,"Brooks, Henry M. (Henry Mason), 1822-1898",New England -- Social life and customs; Lotteries,F,
422,52777,Text,2016-08-11,"Alaska, Its Southern Coast and the Sitkan Archipelago",en,"Scidmore, Eliza Ruhamah, 1856-1928",Alaska -- Description and travel,F,
423,43909,Text,2013-10-08,"Sometub's Cruise on the C. & O. Canal
The narrative of a motorboat vacation in the heart of Maryland",en,"Cowan, John Pryor, 1875-","Chesapeake and Ohio Canal (Md. and Washington, D.C.); Potomac River Valley -- Description and travel",F,
424,20321,Text,2007-01-09,"A Brief Account of the Destruction of the Indies
Or, a faithful NARRATIVE OF THE Horrid and Unexampled Massacres, Butcheries, and all manner of Cruelties, that Hell and Malice could invent, committed by the Popish Spanish Party on the inhabitants of West-India, TOGETHER With the Devastations of several Kingdoms in America by Fire and Sword, for the space of Forty and Two Years, from the time of its first Discovery by them.",en,"Casas, Bartolomé de las, 1484-1566","Indians, Treatment of -- Latin America; Spain -- Colonies -- America",F,
425,58590,Text,2019-01-01,"La Réunion, a French Settlement in Texas",en,"Hammond, Margaret F.; Hammond, William Jackson, 1896-",French -- Texas; Réunion (Tex.),F,
426,7,Text,1977-12-01,The Mayflower Compact,en,,"Massachusetts -- History -- New Plymouth, 1620-1691 -- Sources; Pilgrims (New Plymouth Colony); Mayflower Compact (1620)",F,
427,49021,Text,2015-05-22,"Stephen H. Branch's Alligator, Vol. 1 no. 06, May 29, 1858",en,"Branch, Stephen H. [Editor]",New York (N.Y.) -- Politics and government,F,
428,33621,Text,2010-09-03,"Battle of Fort George: A paper read on March 14th, 1896",en,"Cruikshank, E. A. (Ernest Alexander), 1853-1939","United States -- History -- War of 1812; Fort George (Niagara-on-the-Lake, Ont.); Niagara-on-the-Lake (Ont.) -- History",F,
429,18798,Text,2006-07-09,"Memoria dirigida al Sr. Marquez de Loreto, Virey y Capitan General de las Provincias del Rio de La Plata",es,"Viedma, Francisco de, 1737-1809",Argentina -- History -- 1776-1810; Patagonia (Argentina and Chile) -- History,F,Argentina
430,44609,Text,2014-01-06,"The Northfield Tragedy; or, the Robber's Raid
A Thrilling Narrative; A history of the remarkable attempt to rob the bank at Northfield, Minnesota; the Cold-Blooded Murder of the Brave Cashier and an Inoffensive Citizen. The Slaying of Two of the Brigands. The Wonderful Robber Hunt and Capture Graphically Described. Biographies of the Victims, the Captors & the Notorious Younger and James Gang of Desperadoes",en,"Hanson, J. H. (Joseph Have)",Bank robberies -- Minnesota -- Northfield -- History -- 19th century,F,
431,62155,Text,2020-05-17,"Journal of Travels From St. Josephs to Oregon
With Observations of That Country, Together With Some Description of California, Its Agricultural Interests, and a Full Description of Its Gold Mines.",en,"Root, Riley, 1795-1870; Spalding, Henry Harmon, 1803-1874 [Contributor]",California -- Description and travel; Overland journeys to the Pacific; Oregon -- Description and travel; California -- Gold discoveries; Oregon Territory -- History,F,
432,61555,Text,2020-03-04,"Montezuma National Forest, Colorado (1939)",en,United States. Forest Service. Rocky Mountain Region,San Juan National Forest (Colo.); Uncompahgre National Forest (Colo.); Forest reserves -- Colorado,F,
433,51217,Text,2016-02-14,"Footprints of the Red Men
Indian geographical names in the valley of Hudson's river, the valley of the Mohawk, and on the Delaware: their location and the probable meaning of some of them.",en,"Ruttenber, Edward Manning, 1825-1907","Names, Indian -- North America; Indians of North America -- New York (State); Names, Geographical -- New York (State)",F,
434,56283,Text,2018-01-01,Historia de las Indias (vol. 4 de 5),es,"Casas, Bartolomé de las, 1484-1566","America -- Discovery and exploration -- Spanish -- Early works to 1800; Columbus, Christopher -- Early works to 1800; Indians, Treatment of -- Latin America -- Early works to 1800; Spain -- Colonies -- America -- Early works to 1800",F,
435,36524,Text,2011-06-26,The History of Peru,en,"Beebe, Henry S.",Peru (Ill.) -- History,F,
436,50934,Text,2016-01-15,Augusta Tabor: Her Side of the Scandal,en,"Bancroft, Caroline","Pioneers -- Colorado -- Pikes Peak Region -- Biography; Pikes Peak Region (Colo.) -- Gold discoveries; Frontier and pioneer life -- Colorado -- Pikes Peak Region; Silver mines and mining -- Colorado; Women pioneers -- Colorado -- Pikes Peak Region -- Biography; Leadville (Colo.) -- Social life and customs; Tabor, Augusta, 1833-1895",F,
437,57724,Text,2018-08-18,"A Cyclopaedia of Canadian Biography: Being Chiefly Men of the Time
A Collection of Persons Distinguished in Professional and Political Life, Leaders in the Commerce and Industry of Canada, and Successful Pioneers",en,"Rose, Geo. Maclean (George Maclean), 1829-1898 [Editor]",Canada -- Biography; Canada -- Biography -- Dictionaries,F,
438,14590,Text,2005-01-04,"A New Hochelagan Burying-ground Discovered at Westmount on the Western Spur of Mount Royal, Montreal, July-September, 1898",en,"Lighthall, W. D. (William Douw), 1857-1954",Burial -- Québec (Province) -- Montréal; Iroquois Indians -- Antiquities; Mohawk Indians -- Antiquities,F,
439,57343,Text,2018-06-17,The Negro in Chicago: A Study of Race Relations and a Race Riot,en,Chicago Commission on Race Relations,"African Americans -- Illinois -- Chicago; Chicago Race Riot, Chicago, Ill., 1919; Chicago (Ill.) -- History -- 1875-; Chicago (Ill.) -- Race relations",F,
440,12564,Text,2004-06-01,"California Sketches, New Series",en,"Fitzgerald, O. P. (Oscar Penn), 1829-1911",California -- Social life and customs; California -- Description and travel; Law -- Political aspects -- California; Ethnic groups -- California; Religion and ethics -- California,F,
441,29795,Text,2009-08-25,"An Ode
Read August 15, 1907, at the dedication of the monument erected at Gloucester, Massachusetts, in commemoration of the founding of the Massachusetts Bay colony in the year sixteen hundred and twenty-three",en,"Cawein, Madison Julius, 1865-1914",Poetry,F,
442,56992,Text,2018-04-17,"Stephen H. Branch's Alligator, Vol. 1 no. 14, July 24, 1858",en,"Branch, Stephen H.",New York (N.Y.) -- Politics and government,F,
443,65321,Text,2021-05-11,A Pictorial Guide to Mesa Verde National Park,en,"Hall, Ansel F. (Ansel Franklin), 1894-1962; Hoss, Della Taylor [Illustrator]; Winkler, Merrie [Illustrator]",Mesa Verde National Park (Colo.) -- Guidebooks; Mesa Verde National Park (Colo.) -- Pictorial works,F,
444,38139,Text,2011-11-26,"The History of Cuba, vol. 3",en,"Johnson, Willis Fletcher, 1857-1931",Cuba -- History; Cuba -- Economic conditions,F,
445,49048,Text,2015-05-25,"Two Centuries of New  Milford Connecticut
An Account of the Bi-Centennial Celebration of the Founding of the Town Held June 15, 16, 17, and 18, 1907, With a Number of Historical Articles and Reminiscences",en,Various,New Milford (Conn. : Town) -- History,F,
446,53708,Text,2016-12-10,Tacoma and Vicinity,en,"Oakland Land, Loan and Trust Company",Tacoma (Wash.) -- Pictorial works; Tacoma (Wash.) -- History; Tacoma (Wash.) -- Description and travel,F,
447,53539,Text,2016-11-16,Road Guide to Lassen Volcanic National Park,en,"Schulz, Paul E., 1910-",Lassen Volcanic National Park (Calif.) -- Guidebooks,F,
448,39465,Text,2012-04-17,"Eleven Years in the Rocky Mountains and Life on the Frontier
Also a History of the Sioux War, and a Life of Gen. George A. Custer with Full Account of His Last Battle",en,"Victor, Frances Fuller, 1826-1902","West (U.S.) -- Description and travel; Frontier and pioneer life -- West (U.S.); Custer, George A. (George Armstrong), 1839-1876; Meek, Joseph Lafayette, 1810-1875; Dakota Indians -- Wars, 1876",F,Travel
449,42364,Text,2013-03-18,"Faux's Memorable Days in America, 1819-20; and Welby's Visit to North America, 1819-20, part 2 (1820)",en,"Faux, W. (William); Welby, Adlard; Thwaites, Reuben Gold, 1853-1913 [Editor]",United States -- Description and travel,F,
450,46948,Text,2014-09-24,The Disaster Which Eclipsed History: The Johnstown Flood,en,"Fox, R. K. (Richard Kyle), 1846-1922",Floods -- Pennsylvania -- Johnstown (Cambria County),F,
451,45183,Text,2014-03-21,"Diario de un viage a Salinas Grandes, en los campos del sud de Buenos Aires",es,"García, Pedro Andrés, 1758-1833",Buenos Aires (Argentina : Province) -- Description and travel,F,
452,25255,Text,2008-04-30,"Segunda parte de la crónica del Perú, que trata del señorio de los Incas Yupanquis y de sus grandes hechos y gobernacion",es,"Cieza de León, Pedro de, 1518-1554","Peru -- History -- Conquest, 1522-1548; Peru -- Description and travel -- Early works to 1800; Indians of South America -- Peru -- Social life and customs",F,
453,6933,Text,2004-11-01,"France and England in North America, Part II: The Jesuits in North America in the Seventeenth Century",en,"Parkman, Francis, 1823-1893",Canada -- History -- To 1763 (New France); Jesuits -- Missions -- New France -- History -- 17th century; Wyandot Indians -- Missions -- New France -- History -- 17th century,F,United States
454,58797,Text,2019-01-31,"David Crockett, Scout
Small Boy, Pilgrim, Mountaineer, Soldier, Bear-Hunter and Congressman; Defender of the Alamo",en,"Allen, Charles Fletcher; McKernan, Frank, 1861-1934 [Illustrator]","Crockett, Davy, 1786-1836",F,
455,49506,Text,2015-07-22,"A Summer in the Wilderness
embracing a canoe voyage up the Mississippi and around Lake Superior",en,"Lanman, Charles, 1819-1895","Northwest, Old -- Description and travel; Mississippi River Valley -- Description and travel; Superior, Lake; Michigan -- Description and travel",F,
456,21543,Text,2007-05-20,French Pathfinders in North America,en,"Johnson, William Henry, 1845-1907",New France -- Discovery and exploration; America -- Discovery and exploration -- French,F,
457,24728,Text,2008-03-02,Stories Of Georgia,en,"Harris, Joel Chandler, 1848-1908",Georgia -- History,F,United States
458,37676,Text,2011-10-09,"The History of Cuba, vol. 2",en,"Johnson, Willis Fletcher, 1857-1931",Cuba -- History; Cuba -- Economic conditions,F,
459,46328,Text,2014-07-19,In the Old West,en,"Ruxton, George Frederick Augustus, 1820-1848; Kephart, Horace, 1862-1931 [Editor]",West (U.S.) -- Description and travel; Frontier and pioneer life -- West (U.S.); Hunting -- United States,F,
460,56529,Text,2018-02-08,"After Icebergs with a Painter
A Summer Voyage to Labrador and Around Newfoundland.",en,"Noble, Louis Legrand, 1813-1882",Labrador (N.L.) -- Description and travel; Newfoundland and Labrador -- Description and travel; Icebergs,F,
461,11146,Text,2004-02-01,The Expedition of the Donner Party and its Tragic Fate,en,"Houghton, Eliza Poor Donner",Donner Party; Overland journeys to the Pacific,F,
462,36435,Text,2011-06-16,"Wonderland; or, Alaska and the Inside Passage
With a Description of the Country Traversed by the Northern Pacific Railroad",en,"Hyde, John, 1848-1929; Schwatka, Frederick, 1849-1892","Alaska -- Description and travel; Northwest, Pacific -- Description and travel; Northern Pacific Railroad Company",F,Travel
463,57432,Text,2018-07-01,On Mule Back Thru Central America with the Gospel,en,"Crawford, Mattie; Kinne, Seeley D. [Author of introduction, etc.]","Central America -- Description and travel; Missionaries -- United States -- Biography; Crawford, Mattie; Missions -- Central America; Missionaries -- Central America -- Biography",F,
464,2896,Text,2001-11-01,Story of the Session of the California Legislature of 1909,en,"Hichborn, Franklin, 1869-1963",California -- Politics and government,F,
465,9153,Text,2005-10-01,"The History of Louisiana, Or of the Western Parts of Virginia and Carolina
Containing a Description of the Countries That Lie on Both Sides of the River Missisippi",en,"Le Page du Pratz, -1775",Natural history -- Louisiana -- Early works to 1800; Indians of North America -- Mississippi River Valley -- Early works to 1800; Louisiana -- History -- To 1803; Louisiana -- Description and travel -- Early works to 1800; France -- Colonies -- America,F,
466,41709,Text,2012-12-26,A Girl's Life in Virginia before the War,en,"Burwell, Letitia M.; McCullough, W. A. (William A.) [Illustrator]; Turcas, Jules [Illustrator]",Slavery -- United States; Virginia -- Social life and customs,F,
467,35956,Text,2011-04-25,A Northern Countryside,en,"Richards, Rosalind, 1874-1964",Kennebec County (Me.) -- Description and travel; Gardiner (Me.) -- Description and travel,F,
468,22719,Text,2007-09-22,"Old Fort Snelling, 1819-1858",en,"Hansen, Marcus Lee, 1892-1938",Fort Snelling (Minn.),F,
469,59867,Text,2019-07-06,"Zion National Park, Utah (1951)",en,United States. National Park Service,Zion National Park (Utah) -- Guidebooks,F,
470,33129,Text,2010-07-10,"Incidents of Travel in Yucatan, Vol. I.",en,"Stephens, John L., 1805-1852",Yucatán (Mexico : State) -- Description and travel,F,Travel
471,7099,Text,2004-12-01,A Trip to Manitoba,en,"FitzGibbon, Mary Agnes, 1851-1915",Manitoba -- Description and travel,F,Women's Travel Journals
472,51300,Text,2016-02-25,"Spanish America, Vol. 2 (of 2)",en,"Bonnycastle, Richard Henry, Sir, 1791-1847",Latin America -- History; Latin America -- Description and travel,F,
