,Text#,Type,Issued,Title,Language,Authors,Subjects,LoCC,Bookshelves
1213,63293,Text,2020-09-25,The Fasting Cure,en,"Sinclair, Upton, 1878-1968",Fasting,R,
1214,65912,Text,2021-07-24,"""Swat the Fly!"": A One-Act Fantasy",en,"Gates, Eleanor, 1875-1951",American drama -- 20th century; Flies as carriers of disease,R,
1215,25123,Text,2008-04-22,脾胃論,zh,"Li, Gao, 1180-1251","Medicine, Chinese -- Early works to 1800; Stomach -- Diseases -- Early works to 1800; Spleen -- Diseases -- Early works to 1800; Gastroenterology -- Early works to 1800",R,
1216,52947,Text,2016-08-31,"Dolæus upon the cure of the gout by milk-diet
To which is prefixed, an essay upon diet",en,"Doläus, Johann, 1651-1707; Stephens, William, -1760",Gout -- Treatment -- Early works to 1800; Milk -- Diet therapy -- Early works to 1800,R,
1217,49833,Text,2015-08-31,"Directions for Cooking by Troops, in Camp and Hospital
Prepared for the Army of Virginia, and published by order of the Surgeon General, with essays on ""taking food,"" and ""what food.""",en,"Nightingale, Florence, 1820-1910",Cooking for the sick; Quantity cooking; Cooking for military personnel,R,
1218,41642,Text,2012-12-17,"The Court of Cacus; Or, The Story of Burke and Hare",en,"Leighton, Alexander, 1800-1874","Body snatching; Burke, William, 1792-1829; Hare, William, 1792?-1870?",R,
1219,24893,Text,2008-03-21,In Mesopotamia,en,"Nicoll, Maurice, 1884-1953","Medicine -- History -- 20th century -- Mesopotamia; World War, 1914-1918 -- Campaigns -- Turkey and the Near East -- Mesopotamia",R,
1220,58602,Text,2019-01-03,"A Treatise on Fractures, Luxations, and Other Affections of the Bones",en,"Desault, P.-J. (Pierre-Joseph), 1738-1795; Bichat, Xavier, 1771-1802 [Editor]; Caldwell, Charles, 1772-1853 [Translator]",Surgery; Fractures; Dislocations,R,
1221,46745,Text,2014-09-01,"The Action of Medicines in the System
Or, on the mode in which therapeutic agents introduced into the stomach produce their peculiar effects on the animal economy",en,"Headland, Frederick William",Therapeutics,R,
1222,49513,Text,2015-07-24,"The Complete Herbal
To which is now added, upwards of one hundred additional herbs, with a display of their medicinal and occult qualities physically applied to the cure of all disorders incident to mankind: to which are now first annexed, the English physician enlarged, and key to Physic.",en,"Culpeper, Nicholas, 1616-1654","Botany, Medical; Materia medica, Vegetable; Medicinal plants -- England; Botany, Medical -- England; Herbs -- Therapeutic use; Medicinal plants",R,
1223,4385,Text,2003-08-01,As a Matter of Course,en,"Call, Annie Payson, 1853-1940",Mental health -- Popular works,R,
1224,46727,Text,2014-08-29,An Epitome of the History of Medicine,en,"Park, Roswell, 1852-1914",Medicine -- History,R,
1225,17682,Text,2006-02-05,"The Healthy Life, Vol. V, Nos. 24-28
The Independent Health Magazine",en,"Various; Daniel, Charles William [Editor]","Health -- Periodicals; Medicine, Popular -- Periodicals; Nutrition -- Periodicals",R,Medicine
1226,63497,Text,2020-10-18,"Medicina Gymnastica
or, A treatise concerning the power of exercise, with respect to the animal oeconomy; and the great necessity of it in the cure of several distempers",en,"Fuller, Francis, 1670-1706",Exercise therapy -- Early works to 1800,R,
1227,26718,Text,2008-09-28,Health on the Farm: A Manual of Rural Sanitation and Hygiene,en,"Harris, H. F. (Henry Fauntleroy), 1867-1926","Sanitation, Household; Rural health",R,
1228,19933,Text,2006-11-27,Cluthe's Advice to the Ruptured,en,Cluthe Rupture Institute,Hernia; Trusses (Surgery),R,Medicine
1229,26058,Text,2008-07-14,The Starvation Treatment of Diabetes,en,"Eckman, Rena Sarah, 1868-; Hill, Lewis Webb, 1889-1968",Diabetes; Diet in disease,R,
1230,31230,Text,2010-02-08,Allopathy and Homoeopathy Before the Judgment of Common Sense!,en,"Hiller, Frederick, 1820-","Homeopathy; Hahnemann, Samuel, 1755-1843",R,
1231,60264,Text,2019-09-08,The Virtue and Use of Coffee With Regard to the Plague and Other Infectious Distempers,en,"Bradley, Richard, 1688-1732",Coffee -- Therapeutic use -- Early works to 1800,R,
1232,37640,Text,2011-10-05,Health: Five Lay Sermons to Working-People,en,"Brown, John, 1810-1882",Hygiene; Health; Physician and patient; Child rearing,R,
1233,59175,Text,2019-03-31,"Nashville Journal of Medicine and Surgery, Vol. CX. March, 1916. No. 3",en,"Various; Briggs, Charles S. (Charles Stubbins), 1851-1920 [Editor]; Briggs, W. T. (William Thompson), 1829-1894 [Editor]",Medicine -- Periodicals,R,
1234,48455,Text,2015-03-10,Ten Years and Ten Months in Lunatic Asylums in Different States,en,"Swan, Moses, 1812-","Mentally ill -- Care; Swan, Moses, 1812-; Psychiatric hospitals",R,
1235,1566,Text,2006-02-22,"The Evolution of Modern Medicine
A Series of Lectures Delivered at Yale University on the Silliman Foundation in April, 1913",en,"Osler, William, 1849-1919",Medicine -- History,R,Medicine
1236,24001,Text,2007-12-24,"The Physical Life of Woman: Advice to the Maiden, Wife and Mother",en,"Napheys, George H. (George Henry), 1842-1876",Women -- Health and hygiene,R,Sociology
1237,747,Text,1996-12-01,Anomalies and Curiosities of Medicine,en,"Gould, George M. (George Milbrey), 1848-1922; Pyle, Walter L. (Walter Lytle), 1871-1921","Medicine -- Anecdotes; Abnormalities, Human",R,Medicine
1238,34038,Text,2010-10-05,"Forty Years in the Wilderness of Pills and Powders
Cogitations and Confessions of an Aged Physician",en,"Alcott, William A. (William Andrus), 1798-1859",Medicine -- Anecdotes,R,
1239,52541,Text,2016-07-09,An Essay on the Effects of Opium. Considered as a Poison,en,"Awsiter, John, 1734-",Opium -- Toxicology,R,
1240,50660,Text,2015-12-10,"Encyclopedia of Diet: A Treatise on the Food Question, Vol. 5",en,"Christian, Eugene, 1860-1930",Food; Diet; Diet in disease,R,
1241,33809,Text,2010-09-25,"Tratado metódico y práctico de Materia Médica y de Terapéutica, tomo primero",es,"Espanet, Alexis, 1811-1886; Hernandez y Espeso, Pio [Translator]",Homeopathy -- Materia medica and therapeutics,R,
1242,62587,Text,2020-07-08,"A System of Practical Medicine. By American Authors. Vol. 4
Diseases of the Genito-Urinary and Cutaneous Systems.—Medical Ophthalmology, and Otology",en,"Pepper, William, 1843-1898 [Editor]; Starr, Louis, 1849-1925 [Editor]",Medicine -- Practice,R,
1243,30099,Text,2009-09-27,Hypochondriasis: A Practical Treatise (1766),en,"Hill, John, 1714?-1775",Medicine -- Early works to 1800; Hypochondria -- Early works to 1900,R,
1244,34279,Text,2010-11-11,Handbook of Medical Entomology,en,"Johannsen, O. A. (Oskar Augustus), 1870-1961; Riley, William A. (William Albert), 1876-",Insects as carriers of disease; Insect pests; Medical parasitology,R,
1245,23468,Text,2007-11-13,"Observations on the Causes, Symptoms, and Nature of Scrofula or King's Evil, Scurvy, and Cancer
With Cases Illustrative of a Peculiar Mode of Treatment",en,"Kent, John",Scrofula; Scurvy; Cancer,R,Medicine
1246,53823,Text,2016-12-28,Hygiene des Geschlechtslebens,de,"Gruber, Max von, 1853-1927",Sexual health,R,
1247,14743,Text,2005-01-20,The Fun of Getting Thin: How to Be Happy and Reduce the Waist Line,en,"Blythe, Samuel G. (Samuel George), 1868-1947",Obesity; Weight loss,R,
1248,57122,Text,2018-05-09,"Climate and Health in Hot Countries and the Outlines of Tropical Climatology
A Popular Treatise on Personal Hygiene in the Hotter Parts of the World, and on the Climates That Will Be Met Within Them.",en,"Giles, George Michael James, 1853-1916",Hygiene -- Popular works; Medical climatology; Tropical medicine,R,
1249,59916,Text,2019-07-14,"North Carolina Medical Journal. Vol. 3. No. 4. April, 1879",en,"Various; De Rosset, Moses John, 1838-1881 [Editor]; Wood, Thomas Fanning, 1841-1892 [Editor]",Medicine -- Periodicals; Medicine -- North Carolina -- Periodicals,R,
1250,53325,Text,2016-10-19,"The Cleveland Medical Gazette, Vol. 1, No. 5, March 1886",en,"Various; Baker, A. R. [Editor]; Kelley, Samuel Walter, 1855-1929 [Editor]",Medicine -- Periodicals; Surgery -- Periodicals,R,
1251,62300,Text,2020-06-01,"The Plague of Lust, Vol. 1 (of 2)
Being a History of Venereal Disease in Classical Antiquity",en,"Rosenbaum, Julius, 1807-1874",Sexually transmitted diseases -- History,R,
1252,34189,Text,2010-11-01,Food Poisoning,en,"Jordan, Edwin O. (Edwin Oakes), 1866-1936",Food poisoning; Ptomaine poisoning; Pathogenic microorganisms,R,
1253,44926,Text,2014-02-15,"When You Don't Know Where to Turn
A Self-Diagnosing Guide to Counseling and Therapy",en,"Bartlett, Steven J., 1945-",Psychotherapy; Counseling; Consumer education,R,
1254,13906,Text,2004-10-31,Conception Control and Its Effects on the Individual and the Nation,en,"Barrett, Florence Elizabeth, 1867-1945",Contraception,R,Sociology
1255,22108,Text,2007-07-19,The Untroubled Mind,en,"Hall, Herbert J. (Herbert James), 1870-1923",Mental health,R,Psychology
1256,26008,Text,2008-07-09,Hydriatic treatment of Scarlet Fever in its Different Forms,en,"Munde, Charles",Hydrotherapy; Scarlatina,R,
1257,64237,Text,2021-01-08,"Old Age Deferred
The causes of old age and its postponement by hygienic and therapeutic measures",en,"Lorand, Arnold",Old age; Hygiene; Longevity,R,
1258,38090,Text,2011-11-23,"Nurses' Papers on Tuberculosis :
read before the Nurses' Study Circle of the Dispensary Department, Chicago Municipal Tuberculosis Sanitarium",en,Chicago (Ill.). Municipal Tuberculosis Sanitarium. Dispensary Department,Tuberculosis,R,
1259,59140,Text,2019-03-28,"Étude sur les maladies éteintes et les maladies nouvelles
pour servir à l'histoire des évolutions séculaires de la pathologie",fr,"Anglada, Charles",Medicine -- History; Epidemics -- History,R,FR Sciences et Techniques
1260,14196,Text,2004-11-28,The Nervous Housewife,en,"Myerson, Abraham, 1881-1948",Neurasthenia; Women -- Mental health,R,
1261,63313,Text,2020-09-27,"Neurosyphilis
Modern Systematic Diagnosis and Treatment Presented in One Hundred and Thirty-Seven Case Histories",en,"Solomon, Harry C. (Harry Caesar), 1889-1982; Southard, Elmer Ernest, 1876-1920",Neurosyphilis,R,
1262,25692,Text,2008-06-04,"An Epitome of the Homeopathic Healing Art
Containing the New Discoveries and Improvements to the Present Time",en,"Hill, B. L. (Benjamin L.)",Homeopathy -- Popular works,R,
1263,52722,Text,2016-08-04,"An account of the manner of inoculating for the small pox in the East Indies
With some observations on the practice and mode of treating that disease in those parts",en,"Holwell, J. Z. (John Zephaniah), 1711-1798",Smallpox -- Vaccination; Smallpox -- Prevention,R,
1264,49054,Text,2015-05-26,"Anatomy and Embalming
A Treatise on the Science and Art of Embalming, the Latest and Most Successful Methods of Treatment and the General Anatomy Relating to this Subject",en,"Dhonau, Charles Otto, 1886-; Nunnamaker, Albert John, 1885-1928",Embalming,R,
1265,37267,Text,2011-08-29,So sollt ihr leben! Winke und Rathschläge für Gesunde und Kranke...,de,"Kneipp, Sebastian, 1821-1897",Hygiene; Health; Hydrotherapy,R,DE Sachbuch
1266,60338,Text,2019-09-22,An Enquiry Into the Origin and Intimate Nature of Malaria,en,"Wilson, Thomas, active 1795-1858",Malaria,R,
1267,19072,Text,2006-08-18,"Opuscula Selecta Neerlandicorum
Nederlandsch Tijdschrift voor Geneeskunde",la; nl,"Boerhaave, Herman, 1668-1738 [Contributor]; Donders, F. C. (Franciscus Cornelis), 1818-1889 [Contributor]; Erasmus, Desiderius, 1469-1536 [Contributor]; Gaubius, Hieronymus David, 1705?-1780 [Contributor]; Leeuwenhoek, Antoni van, 1632-1723 [Contributor]; Swammerdam, Jan, 1637-1680 [Contributor]; Treub, Hector, 1856-1920 [Editor]",Medicine -- Netherlands -- History,R,
1268,64207,Text,2021-01-03,"Of Medicine, in Eight Books",en,"Celsus, Aulus Cornelius, 25? BCE-50?; Greive, James, -1773 [Translator]","Medicine, Greek and Roman",R,
1269,54008,Text,2017-01-18,Technic and Practice of Chiropractic,en,"Loban, Joy Maxwell, 1887-",Chiropractic,R,
1270,25020,Text,2008-04-08,Humanistic Nursing,en,"Paterson, Josephine G.; Zderad, Loretta T.",Nursing; Nursing -- Philosophy,R,Medicine
1271,18487,Text,2006-06-01,Food Remedies: Facts About Foods And Their Medicinal Uses,en,"Daniel, Florence",Diet therapy; Nutrition; Functional foods,R,
1272,47078,Text,2014-10-08,A Manual of Clinical Diagnosis,en,"Todd, James Campbell, 1874-1928","Diagnosis, Laboratory",R,
1273,25601,Text,2008-05-26,Fasting Girls: Their Physiology and Pathology,en,"Hammond, William A. (William Alexander), 1828-1900","Psychology, Pathological; Medicine -- Case studies -- 1800-1900; Anorexia in children; Fasting",R,
1274,53863,Text,2017-01-01,"A Special Mortality among Infants at Loughton, in the Epping Rural Sanitary District",en,"Power, William Henry, Sir, 1842-1916","Powders -- Toxicology -- England -- Loughton (Essex); Infants -- Death -- England -- Loughton (Essex); Infants -- Health and hygiene -- England -- Loughton (Essex); Loughton (Essex, England) -- Social conditions -- 19th century",R,
1275,21418,Text,2007-05-11,"The Eugenic Marriage, Volume 4 (of 4)
A Personal Guide to the New Science of Better Living and Better Babies",en,"Hague, W. Grant (William Grant), 1868-",Hygiene; Marriage; Eugenics,R,Medicine; Sociology
1276,15069,Text,2005-02-15,Diet and Health; With Key to the Calories,en,"Peters, Lulu Hunt, 1873-1930",Diet,R,"Technology; Bestsellers, American, 1895-1923; Cookbooks and Cooking"
1277,50640,Text,2015-12-08,Elements of Surgery,en,"Liston, Robert, 1794-1847; Gross, Samuel D. (Samuel David), 1805-1884 [Editor]",Surgery,R,
1278,49377,Text,2015-07-06,Radioisotopes in Medicine,en,"Phelan, Earl W., 1900-1993",Nuclear medicine,R,
1279,29414,Text,2009-07-15,"An Inquiry into the Causes and Effects of the Variolae Vaccinae
A Disease Discovered in Some of the Western Counties of England, Particularly Gloucestershire, and Known by the Name of the Cow Pox",en,"Jenner, Edward, 1749-1823",Smallpox -- Vaccination -- Early works to 1800; Vaccinia -- Early works to 1800; Vaccination -- Early works to 1800,R,
1280,31367,Text,2010-02-23,The Training of a Forester,en,"Pinchot, Gifford, 1865-1946",Forests and forestry; Forestry schools and education -- United States; Forests and forestry -- Vocational guidance,S,Forestry
1281,53447,Text,2016-11-04,The Fishing Industry,en,"Gibbs, William E. (William Edward)",Fisheries -- Great Britain; Fisheries,S,
1282,26903,Text,2008-10-12,Determining the Age of Cattle by the Teeth,en,"Pope, George W. (George Whitfield), 1867-",Cattle -- Age determination,S,
1283,33572,Text,2010-08-29,Breves palavras sobre a cultura da Oliveira,pt,"Nunes d'Almeida, Avelino",Olive,S,PT Ciência e Técnica
1284,42718,Text,2013-05-16,Field Mice as Farm and Orchard Pests,en,"Lantz, David E. (David Ernest), 1855-1918",Microtus -- Control; Pitymys -- Control; Agricultural pests; Fruit -- Diseases and pests,S,
1285,39965,Text,2012-06-10,American Big-Game Hunting: The Book of the Boone and Crockett Club,en,"Boone and Crockett Club; Grinnell, George Bird, 1849-1938 [Editor]; Roosevelt, Theodore, 1858-1919 [Editor]",Big game hunting -- United States,S,
1286,49454,Text,2015-07-16,"The Mentor: Reclaiming the Desert, Vol. 6, Num. 17, Serial No. 165, October 15, 1918",en,"Blanchard, C. J. (Clarence John), 1863-","Desert reclamation -- Southwest, New; Desert resources development -- Southwest, New; Irrigation -- Southest, New",S,The Mentor
1287,43797,Text,2013-09-23,Favorite Fish and Fishing,en,"Henshall, James A. (James Alexander), 1836-1925",Fishes -- North America; Fishing -- North America,S,
1288,34672,Text,2010-12-16,Fish Stories,en,"Abbott, Henry, 1850-1943",Fishing,S,Animal; Animals-Wild
1289,55591,Text,2017-09-21,"Old Fashioned Flowers, and other out-of-door studies",en,"Maeterlinck, Maurice, 1862-1949; Teixeira de Mattos, Alexander, 1865-1921 [Translator]",Gardening; Flowers,S,
1290,10878,Text,2004-01-01,"The Mule: A Treatise on the Breeding, Training, and Uses to Which He May Be Put",en,"Riley, Harvey",Mules,S,
1291,59284,Text,2019-04-15,"The American Bee Journal, Volume XXXIII, No. 4, January 25, 1894",en,"Various; York, George W. [Editor]",Bee culture -- Periodicals,S,The American Bee Journal
1292,34173,Text,2010-10-30,"Canadian Wilds
Tells About the Hudson's Bay Company, Northern Indians and Their Modes of Hunting, Trapping, Etc.",en,"Hunter, Martin",Hudson's Bay Company; Hunting -- Canada,S,
1293,53678,Text,2016-12-06,"On Naval Timber and Arboriculture
With Critical Notes on Authors who have Recently Treated the Subject of Planting",en,"Matthew, Patrick, 1790-1874",Forests and forestry -- Great Britain,S,
1294,59315,Text,2019-04-20,"The Periodical Cicada, ""the 17-year Locust""",en,United States. Department of Agriculture,Periodical cicada,S,
1295,50944,Text,2016-01-17,"Salmonia; Or, Days of Fly Fishing
In a series of conversations. With some account of the habits of fishes belonging to the genus Salmo",en,"Davy, Humphry, Sir, 1778-1829",Fishing,S,
1296,17683,Text,2006-02-05,"The Prairie Farmer, Vol. 56, No. 2, January 12, 1884
A Weekly Journal for the Farm, Orchard and Fireside",en,Various,Farm life -- Periodicals; United States -- Rural conditions -- Periodicals; Agriculture -- United States -- Periodicals,S,Prairie Farmer
1297,29665,Text,2009-08-11,"Prairie Farmer, Vol. 56: No. 4, January 26, 1884
A Weekly Journal for the Farm, Orchard and Fireside",en,Various,Farm life -- Periodicals; United States -- Rural conditions -- Periodicals; Agriculture -- United States -- Periodicals,S,Prairie Farmer
1298,56477,Text,2018-01-31,"The Lady's Country Companion; Or, How to Enjoy a Country Life Rationally",en,"Loudon, Mrs. (Jane), 1807-1858",Cooking; Country life; Home economics,S,
1299,42767,Text,2013-05-22,Home Life on an Ostrich Farm,en,"Martin, Annie, Mrs.",Cape of Good Hope (South Africa) -- Description and travel; Ostrich farms,S,
1300,40302,Text,2012-07-23,"Sporting Society; or, Sporting Chat and Sporting Memories, Vol. 2 (of 2)",en,"Russell, Fox [Editor]; Caldecott, Randolph, 1846-1886 [Illustrator]",Fishing -- Great Britain; Fox hunting -- Great Britain; Horse racing -- Great Britain; Hunting -- Great Britain,S,
1301,4221,Text,2003-07-01,"Shearing in the Riverina, New South Wales",en,"Boldrewood, Rolf, 1826-1915",Sheep-shearing -- Australia,S,Australia
1302,49876,Text,2015-09-04,"The Mentor: Game Birds of America, Vol. 1, Num. 34, Serial No. 34",en,"Forbush, Edward Howe, 1858-1929",Game and game-birds -- United States; Game and game-birds -- North America,S,The Mentor
1303,34229,Text,2010-11-07,"Steel Traps
Describes the Various Makes and Tells How to Use Them, Also Chapters on Care of Pelts, Etc.",en,"Harding, A. R. (Arthur Robert), 1871-1930",Trapping,S,
1304,56135,Text,2017-12-06,"Tobacco: Growing, Curing, & Manufacturing
A Handbook for Planters in All Parts of the World",en,"Lock, Charles G. Warnford (Charles George Warnford), 1853-1909 [Editor]",Tobacco; Tobacco industry,S,
1305,38189,Text,2011-12-02,"A Treatise on Sheep:
The Best Means for their Improvement, General Management, and the Treatment of their Diseases.",en,"Blacklock, Ambrose, 1816-1873",Sheep,S,Animals-Domestic
1306,28594,Text,2009-04-23,The Peanut Plant: Its Cultivation And Uses,en,"Jones, B. W.",Peanuts,S,
1307,55729,Text,2017-10-10,Bananas: Nature's Institution for the Promotion of Laziness,en,"Perry, Edward Wilkin",Bananas,S,
1308,48234,Text,2015-02-11,Der Damen-Reitsport,de,"Schoenbeck, Richard, 1840-1919",Horsemanship; Sidesaddle riding; Women in horse sports,S,
1309,32392,Text,2010-05-15,Notes on Agriculture in Cyprus and Its Products,en,"Bevan, William, 1864-",Agriculture -- Cyprus; Produce trade -- Cyprus,S,
1310,63094,Text,2020-08-31,Sewage and sewerage of farm homes [1922],en,"Warren, George M. (George Milton)","Sewage disposal, Rural; Sewerage, Rural",S,
1311,39610,Text,2012-05-04,Riding for Ladies,en,"Kerr, W. A. (William Alexander), 1831-1919",Horsemanship,S,
1312,4509,Text,2003-10-01,Three Acres and Liberty,en,"Hall, Bolton, 1854-1938",Agriculture,S,
1313,48584,Text,2015-03-25,"Big Game Shooting, volume 1 (of 2)",en,"Phillipps-Wolley, Clive, -1918; Whymper, Charles, 1853-1941 [Illustrator]",Hunting; Game and game-birds,S,
1314,59071,Text,2019-03-16,Inter-Ocean Hunting Tales,en,"Randolph, Edgar Fritz, 1861-",Hunting -- United States,S,
1315,48985,Text,2015-05-17,"The English Flower Garden
with illustrative notes",en,"Bright, Henry Arthur, 1830-1884",Flower gardening -- England; Gardens -- England,S,
1316,37373,Text,2011-09-10,Indian Scout Talks: A Guide for Boy Scouts and Camp Fire Girls,en,"Eastman, Charles A., 1858-1939",Boy Scouts; Indians of North America -- Social life and customs; Outdoor life; Camp Fire Girls,S,
1317,14293,Text,2004-12-07,The Complete Book of Cheese,en,"Brown, Bob, 1886-1959",Cheese; Cooking (Cheese),S,Cookbooks and Cooking
1318,39605,Text,2012-05-03,Hand-book for Horsewomen,en,"Bussigny, H. L. de (Henry L. de), 1840-",Horsemanship,S,
1319,52098,Text,2016-05-18,"Tachyhippodamia; Or, The new secret of taming horses
To which is added The breaking, training, and taming horses",en,"Powell, Willis J.; Rarey, J. S. (John Solomon), 1827-1866",Horses -- Training,S,
1320,34773,Text,2010-12-28,Woodcraft,en,"Kreps, Elmer Harry, 1880-",Camping; Outdoor life,S,
1321,24559,Text,2008-02-09,"Northern Nut Growers Association Report of the Proceedings at the Fifth Annual Meeting
Evansville, Indiana, August 20 and 21, 1914",en,Northern Nut Growers Association [Editor],Northern Nut Growers Association -- Periodicals; Nut trees -- Periodicals; Nuts -- Periodicals,S,Northern Nut Growers Association
1322,48437,Text,2015-03-08,The Art and Practice of Hawking,en,"Michell, E. B. (Edward Blair), 1843-; Lodge, George Edward, 1860-1954 [Illustrator]",Falconry,S,
1323,58385,Text,2018-12-01,"The American Apiculturist. Vol. III. No. 6, June 15, 1885
A Journal Devoted to Scientific and Practical Beekeeping",en,"Various; Locke, Silas M. [Editor]",Bee culture -- Periodicals,S,
1324,58189,Text,2018-10-29,"The American Bee Journal, Vol. VI., Number 5, November 1870",en,"Various; Wagner, Samuel [Editor]",Bee culture -- Periodicals,S,The American Bee Journal
1325,40670,Text,2012-09-05,Makers of Modern Agriculture,en,"Macdonald, William","Agriculturists -- Biography; Coke, Thomas William, Earl of Leicester, 1752-1842; McCormick, Cyrus Hall, 1809-1884; Sinclair, John, Sir, 1754-1835; Tull, Jethro, 1674-1741; Young, Arthur, 1741-1820",S,
1326,48835,Text,2015-04-30,Sport in the Crimea and Caucasus,en,"Phillipps-Wolley, Clive, -1918",Caucasus -- Description and travel; Crimea (Ukraine) -- Description and travel; Hunting -- Ukraine -- Crimea; Hunting -- Caucasus,S,
1327,38606,Text,2012-01-18,"Poultry
A Practical Guide to the Choice, Breeding, Rearing, and Management of all Descriptions of Fowls, Turkeys, Guinea-fowls, Ducks, and Geese, for Profit and Exhibition.",en,"Piper, Hugh",Poultry -- Breeding,S,
1328,59579,Text,2019-05-22,"The American Agriculturist. Vol. II. No. XI, December 1843
Designed to Improve the Planter, the Farmer, the Stock-breeder, and the Horticulturist",en,"Various; Allen, A. B. (Anthony Benezet), 1802-1892 [Editor]",Agriculture -- United States -- Periodicals; Agriculture -- Periodicals,S,
1329,63166,Text,2020-09-10,Growing Crimson Clover,en,"Kephart, Leonard Wheeler, 1892-",Crimson clover,S,
1330,56616,Text,2018-02-21,"The Canadian Horticulturist, Volume I
Compendium & Index",en,"Various; Beadle, Delos W. (Delos White), 1823-1905 [Editor]",Horticulture -- ​​Canada -- ​Periodicals; Fruit-​culture -- ​​Canada -- ​Periodicals; Floriculture -- ​Canada -- ​Periodicals; Gardening -- ​Canada -- ​Periodicals,S,
1331,28563,Text,2009-04-12,"Hints on Horsemanship, to a Nephew and Niece
or, Common Sense and Common Errors in Common Riding",en,"Greenwood, George, 1799-1875",Horsemanship,S,
1332,33060,Text,2010-07-03,A Living from the Land,en,"Duryee, William Budington, 1888-",Agriculture,S,
1333,58961,Text,2019-02-25,"The American Bee Journal. Vol. XVII. No. 14. April 6, 1881",en,"Various; Newman, Thomas G. (Thomas Gabriel), 1833-1903 [Editor]",Bee culture -- Periodicals,S,The American Bee Journal
1334,12140,Text,2004-04-01,Roman Farm Management: The Treatises of Cato and Varro,en,"Cato, Marcus Porcius, 234 BCE-149 BCE; Varro, Marcus Terentius; Harrison, Fairfax, 1869-1938 [Translator]",Agriculture -- Early works to 1800; Farm management -- Early works to 1800,S,Classical Antiquity
1335,17093,Text,2005-11-18,Camp Life in the Woods and the Tricks of Trapping and Trap Making,en,"Gibson, W. Hamilton (William Hamilton), 1850-1896",Camping; Trapping,S,
1336,34063,Text,2010-10-12,"Fifty Years a Hunter and Trapper
Autobiography, experiences and observations of Eldred Nathaniel Woodcock during his fifty years of hunting and trapping.",en,"Woodcock, E. N. (Eldred Nathaniel), 1846-1917; Harding, A. R. (Arthur Robert), 1871-1930 [Editor]",Hunting; Trapping,S,Animal; Animals-Wild-Trapping
1337,63805,Text,2020-11-18,"Old Sports and Sportsmen; or, the Willey Country
with sketches of Squire Forester and his whipper-in Tom Moody",en,"Randall, John, 1810-1910","Shropshire (England) -- History; Hunting -- England -- Shropshire; Forester, George, -1811",S,
1338,64352,Text,2021-01-20,"The Illustrated Horse Doctor
Being an accurate and detailed account of the various diseases to which the equine race are subjected",en,"Mayhew, Edward, 1813?-1868",Horses -- Diseases,S,
1339,50207,Text,2015-10-14,Tea-Blending as a Fine Art,en,"Walsh, Joseph M.",Tea,S,
1340,18913,Text,2006-07-26,"Hardy Perennials and Old Fashioned Flowers
Describing the Most Desirable Plants, for Borders, Rockeries, and Shrubberies.",en,"Wood, J. G. (John George), 1827-1889",Flowers; Perennials,S,Horticulture
1341,34376,Text,2010-11-22,Our Domestic Birds: Elementary Lessons in Aviculture,en,"Robinson, John H. (John Henry), 1863-1935",Poultry; Pigeons; Cage birds,S,Animals-Domestic
1342,63013,Text,2020-08-23,War Gardens: A Pocket Guide for Home Vegetable Growers,en,"Free, Montague, 1885-1965",Vegetable gardening,S,
